{
  "topic": "Flutter Packages and Plugins",
  "description": "Interview questions covering popular Flutter packages, plugin development, dependency management, and package ecosystem",
  "version": "2.0.0",
  "last_updated": "2026-05-13",
  "flutter_version_target": "3.27",
  "questions": [
    {
      "id": "packages_and_plugins_001",
      "question": "What are packages in Flutter, and how are they different from plugins?",
      "answer": "- Packages are reusable libraries containing Dart code, while plugins provide access to native device features and APIs through platform channels.",
      "difficulty": "beginner",
      "tags": [
        "packages",
        "plugins",
        "basics"
      ]
    },
    {
      "id": "packages_and_plugins_002",
      "question": "How do you add a package to a Flutter project?",
      "answer": "- You can add a package by including it in the `dependencies` section of the `pubspec.yaml` file and then running `flutter pub get`.",
      "difficulty": "beginner",
      "tags": [
        "packages",
        "pubspec",
        "setup"
      ]
    },
    {
      "id": "packages_and_plugins_003",
      "question": "What is pubspec.yaml, and how is it used to manage packages?",
      "answer": "- `pubspec.yaml` is a configuration file for Flutter projects that defines the project's metadata, dependencies, and assets.",
      "difficulty": "beginner",
      "tags": [
        "packages",
        "pubspec",
        "configuration"
      ]
    },
    {
      "id": "packages_and_plugins_004",
      "question": "How do you install a specific version of a package in Flutter?",
      "answer": "- Specify the version in `pubspec.yaml` like this: `package_name: ^1.2.3`, and run `flutter pub get`.",
      "difficulty": "beginner",
      "tags": [
        "packages",
        "versioning",
        "dependencies"
      ]
    },
    {
      "id": "packages_and_plugins_005",
      "question": "What is the difference between dependencies and dev_dependencies in pubspec.yaml?",
      "answer": "- `dependencies` are required for the app's functionality, while `dev_dependencies` are only needed for development and testing.",
      "difficulty": "beginner",
      "tags": [
        "packages",
        "dependencies",
        "configuration"
      ]
    },
    {
      "id": "packages_and_plugins_006",
      "question": "How do you create a custom package in Flutter?",
      "answer": "- Use the command `flutter create --template=package package_name`, then implement your functionality in the created directory.",
      "difficulty": "intermediate",
      "tags": [
        "packages",
        "development",
        "custom"
      ]
    },
    {
      "id": "packages_and_plugins_007",
      "question": "What is the pub command, and how is it used to manage packages?",
      "answer": "- The `pub` command is a tool for managing Dart packages, allowing you to add, remove, and update dependencies.",
      "difficulty": "beginner",
      "tags": [
        "packages",
        "pub",
        "commands"
      ]
    },
    {
      "id": "packages_and_plugins_008",
      "question": "How do you use the path package in Flutter?",
      "answer": "- Add `path` to your dependencies, then import it to work with file and directory paths in a platform-agnostic way.",
      "difficulty": "beginner",
      "tags": [
        "packages",
        "path",
        "files"
      ]
    },
    {
      "id": "packages_and_plugins_009",
      "question": "What is the http package, and how is it used for networking?",
      "answer": "- The `http` package provides a simple way to make HTTP requests and handle responses. You can use it to perform GET, POST, and other types of requests.",
      "difficulty": "beginner",
      "tags": [
        "packages",
        "http",
        "networking"
      ]
    },
    {
      "id": "packages_and_plugins_010",
      "question": "How do you handle JSON serialization with the json_serializable package?",
      "answer": "- Add `json_serializable` to your `dev_dependencies`, then annotate your model classes with `@JsonSerializable()` and use the `fromJson` and `toJson` methods.",
      "difficulty": "intermediate",
      "tags": [
        "packages",
        "json",
        "serialization"
      ]
    },
    {
      "id": "packages_and_plugins_011",
      "question": "What is the provider package, and how is it used for state management?",
      "answer": "- The `provider` package is a popular state management solution that uses InheritedWidgets to efficiently manage app state.",
      "difficulty": "intermediate",
      "tags": [
        "packages",
        "provider",
        "state-management"
      ]
    },
    {
      "id": "packages_and_plugins_012",
      "question": "How do you use the shared_preferences package for local storage?",
      "answer": "- Add `shared_preferences` to your dependencies, import it, and use `SharedPreferences.getInstance()` to read and write key-value pairs.",
      "difficulty": "beginner",
      "tags": [
        "packages",
        "shared-preferences",
        "storage"
      ]
    },
    {
      "id": "packages_and_plugins_013",
      "question": "What is the get_it package, and how does it help with dependency injection?",
      "answer": "- `get_it` is a simple service locator for Dart and Flutter that helps manage dependencies by registering and retrieving instances.",
      "difficulty": "intermediate",
      "tags": [
        "packages",
        "get-it",
        "dependency-injection"
      ]
    },
    {
      "id": "packages_and_plugins_014",
      "question": "How do you use the flutter_local_notifications package for sending notifications?",
      "answer": "- Add `flutter_local_notifications` to your dependencies, initialize it, and use methods to schedule or display notifications.",
      "difficulty": "intermediate",
      "tags": [
        "packages",
        "notifications",
        "local"
      ]
    },
    {
      "id": "packages_and_plugins_015",
      "question": "What is the sqflite package, and how is it used for database storage?",
      "answer": "- `sqflite` is a Flutter plugin for SQLite, allowing you to store and query structured data in a local database.",
      "difficulty": "intermediate",
      "tags": [
        "packages",
        "sqflite",
        "database"
      ]
    },
    {
      "id": "packages_and_plugins_016",
      "question": "How do you use the hive package for lightweight key-value storage?",
      "answer": "- Add `hive` to your dependencies, initialize it, and use Hive's API to store and retrieve key-value pairs.",
      "difficulty": "intermediate",
      "tags": [
        "packages",
        "hive",
        "storage"
      ]
    },
    {
      "id": "packages_and_plugins_017",
      "question": "What is the dio package, and how is it different from the http package?",
      "answer": "- `dio` is a powerful HTTP client that supports interceptors, global configuration, and more advanced features compared to the `http` package.",
      "difficulty": "intermediate",
      "tags": [
        "packages",
        "dio",
        "networking"
      ]
    },
    {
      "id": "packages_and_plugins_018",
      "question": "How do you use the url_launcher package to open URLs in Flutter?",
      "answer": "- Add `url_launcher` to your dependencies, import it, and use `launch(url)` to open web pages or apps.",
      "difficulty": "beginner",
      "tags": [
        "packages",
        "url-launcher",
        "navigation"
      ]
    },
    {
      "id": "packages_and_plugins_019",
      "question": "What is the image_picker package, and how is it used to select images?",
      "answer": "- `image_picker` allows users to pick images from the gallery or take photos using the camera. Import it and call `ImagePicker().getImage()`.",
      "difficulty": "beginner",
      "tags": [
        "packages",
        "image-picker",
        "media"
      ]
    },
    {
      "id": "packages_and_plugins_020",
      "question": "How do you use the flutter_svg package to work with SVG files in Flutter?",
      "answer": "- Add `flutter_svg` to your dependencies, import it, and use the `SvgPicture.asset()` method to display SVG images.",
      "difficulty": "beginner",
      "tags": [
        "packages",
        "svg",
        "images"
      ]
    },
    {
      "id": "packages_and_plugins_021",
      "question": "What is the firebase_core package, and why is it necessary for Firebase integration?",
      "answer": "- `firebase_core` is required to initialize Firebase services in your app. It must be added to your dependencies.",
      "difficulty": "beginner",
      "tags": [
        "packages",
        "firebase",
        "setup"
      ]
    },
    {
      "id": "packages_and_plugins_022",
      "question": "How do you use the cloud_firestore package for Firestore database access?",
      "answer": "- Add `cloud_firestore`, initialize Firebase, and use `FirebaseFirestore.instance` to perform CRUD operations.",
      "difficulty": "intermediate",
      "tags": [
        "packages",
        "firestore",
        "database"
      ]
    },
    {
      "id": "packages_and_plugins_023",
      "question": "What is the flutter_bloc package, and how is it used for state management?",
      "answer": "- The `flutter_bloc` package implements the BLoC (Business Logic Component) pattern, providing a structured way to manage state using streams and events.",
      "difficulty": "intermediate",
      "tags": [
        "packages",
        "bloc",
        "state-management"
      ]
    },
    {
      "id": "packages_and_plugins_024",
      "question": "How do you use the fluttertoast package to display toast messages?",
      "answer": "- Add `fluttertoast` to your dependencies and call `Fluttertoast.showToast()` to display toast notifications.",
      "difficulty": "beginner",
      "tags": [
        "packages",
        "toast",
        "ui"
      ]